{
    "maxLife": 20,
    "idleTime": 3.3,
    "regenSpd": 6.6,
    "bulletDmgFactor": 0.7,
    "energyDmgFactor": 1.0,
    "explosionDmgFactor": 1.0,
    "price": 200,
    "displayName": "Shield",
    "absorbSound": "core:shield1Absorb1",
    "absorbSoundPitch": 1,
    "regenSound": "core:shield1Regen"
}
